source,phone,review,rating
att.com,iphone,"I’ve been with Apple since day 1 of 2007 and the X is by far the best phone to date for sure!! No matter what people are saying about the 7 plus being bigger it’s def not,just read the specs that should be enough right there and all the great new features that come with this phone are fantastic if your due for an upgrade get the X you will not be disappointed,don’t be fooled by the bunk reviews the X is by far the best Phone on the market today!!",5
att.com,iphone,"I went to this from a 6 and no matter what, transfer from one phone to another is never seamless. The biggest thing is no more finger prints! So everything you get into with a fingerprint, you need to remember the password to. I locked myself out of 3 of my accounts. That was a pain, and not every app does facial recognition so be prepared to change passwords, which isn’t a bad thing really. Getting used to swiping everything is easy once you know how and which way to swipe. No home button. But it is easy to forget once you get used to swiping. Battery lasts all day. Big plus. Fast. Bigger plus. I am enjoying getting to know the X.",5
att.com,iphone,"Upgraded from a 3.5 year old iPhone 6. The best thing about this phone is that its overall size is barely larger than my old 6 yet the screen is about 95% the size of my wife's 8+. Larger screen, small package. Face ID is nearly instantaneous. I thought it was a gimmick at first but now that I'm used to it, I don't even think about it. Just pick the phone up, swipe up, and I'm in. I have a 7 for work and when I pick it up, I realize how much I love not having to ever fiddle with the home button--for anything, ever with the X. Screen is amazing. Camera is amazing. I will likely be with this thing for another 3.5 years and I'm fine with that.",5
att.com,iphone,I love how fast this version of iPhone is! But the lack of TouchID makes me realize how much I missed that feature. I may have to get a vertical holder for my car in order to be truly handsfree because the FaceID does not read your face when iPhone is in landscape mode.,4
att.com,iphone,"Surfing the internet is really truly fast almost like using mynhome pc. The text to speech is very accurate. I travel theu the US and the screen does not freeze like people wore claiming. Which was why I waited to upgrade and i travel to places that are -25 degrees. The facial recognition makes it easier to open my phone and you can incorporate it into most apps for ease of use. The camera takes awesome pics and its an all around pretty phone. Big screen enough to watch movies but also compact enough to text with one hand. I Love this phone and it takes care of my personal, financial and work needs. Plus large capacity storage for the size.",5
att.com,iphone,"I was SUPER excite about getting this phone. Pre-ordered it and waited anxiously for it to arrive. When it came and I was able to open it, the size surprised me. It was so small compared to my 7+. After having this phone for about 2 weeks now it leaves a lot to be desired. Most apps don't take up the full screen, leaving a back bar of empty, unused space at the top and bottom, which in turn makes the screen smaller then my 7+. The camera isn't thaatt much better than my 7+. Its thicker and heavier. It seems to be that for what it cost you get a device that leaves a lot to desired. It made me start looking at the Note 8.........",3
att.com,iphone,More hype than substance. While the facial recognition system is nice performance is lacking. Phone connection is not clear. Have many complaints that I can not be heard when calling others compared to my old iPhone 7plus. Despite the hype screen size is underwhelming. Improvement on the top & bottom of screen is ineffective when watching video. Width significantly smaller than iPhone 7+ that impacts reading. (See Photo). Best feature is the camera that allows greater control. Multiple consumer reviews state it is the most breakable phone ever. Finally uying experience was dreadful. Miss days when customer service personal instead of dropped internet connections. Plans that promote free upgrades are worthless when new phones work less effectively than ones they replace.,2
att.com,iphone,"When I saw the first ad for the iPhone X I was like I want that phone. Now that I have had it since the release date I love it but at first I was like oh my what have I done.but I’m happy I stayed with the x. People complain apps are not setup to take full advantage of the x , sadly they knew this going in. Yeah it’s not as big as my 7 plus but you know over all it seems to be a way better phone. The call clarity is amazing. The battery life last a full 2 days for me. The screen is breath taking. And people keep saying the phone is fragile I don’t see it I have dropped mine from waist height about 6 times not even a scratch or crack",5
att.com,iphone,"I’ve been a 10 year Samsung user. I fell in love with this iPhone after a few minutes. I actually just upgraded to a note 8 in November but liked this phone so much that I decided to add a line and get this one. I don’t even touch my note now. Although, it takes me about an hour longer to change my iPhone 10 than It ever did to charge my note. Get the fat charging cube and it will shave some time off of having to wait for a full charge. It’s got a few bugs with compatibility issues, like with he Fitbit, and my gotomeeting call in audio, but other than that I love it. The way to close out of apps is awkward, as well so if they could change that it would be perfect.",5
att.com,iphone,"I can't understand the negative reviews. I have owned every I Phone since their inception. The I Phone X is hands down the best to date. Maneuvering the screen is slightly different but you adjust quickly. The home button is actually an improvement in my opinion. Facial recognition took less then 2 minutes to set up. Additionally facial recognition is quicker and more efficient then the old thumb print on the home button.
Battery life, so far, is outstanding. My other I phones I was charging every 12 hours or so based on my usage. My I Phone X is being charged about every 24 hours. A major improvement, although my results may not be typical. Buy it I don't think that you will have any regrets.",5
att.com,iphone,"Within an hour of getting my phone and setting it up I saw it. There's a 8mm semi-circular crack in my ""gorilla glass"" screen. I didn't notice it at first until I took the phone outside to play with the new camera (which has so many lens flares that are another issue entirely). With the screen illuminated, it's barely noticeable. A phone Of this level should have higher quality standards. I went to the AT&T store and they said they couldn't help me, to take it back to Apple. This is unacceptable in a new product.",1
att.com,iphone,"Just picked up my x on release date i was worried that with a home button i would not like it it. I was wrong it makes life easier especially the face recognition which i was skeptical at first. I really like the touch on my 7+ but face reconition is much faster. Overall this is a big improvement over my 7+ which i thought i was not going to switch but i am glad i did. If you want a smaller phone that will fit better in your pocket with a large screen, faster processor, better camera, faster access to menu then you wont go wrong with the X. Thank you Apple great IPhone",5
att.com,iphone,Apple has done it again. 4K 60fps 4K 24fps no one has this not even super expensive dslr’s. Screen is the best in the industry colors are spot on. I love how it fits perfect in my hand. It is the perfect balance of size and screen realestste. It doesn’t feel overly big tlike the 7 plus did. This phone is a straight monster in performance destroying everything in the market. Face ID is spot on and the gestures are super easy to learn people just don’t like change and complain. Is it worth the money? Yes it is the camera alone is worth the price having all of the shooting options right in your pocket. Well done Apple.,5
att.com,iphone,"I have had iPhone since the first model came out, I upgraded from the 7+ to the iPhone X. I have to say I’ve not been blown away, or even remotely impressed. The new “features” seem to be an attempt to make it seem there was some great changes by simply changing the way things were done, but in a more complicated way. And sorry but you could easily bring the home button back and make everyone happy. I like the size of my 7+ in my hand, personally liked the larger phone. I’m just not really seeing the added value in this phone and find it over rated. I’ve seriously been considering swapping it out for the 8+ and holding out to see if Apply might actually put out another WOW phone soon.",3
att.com,iphone,"Most durable glass ever? I laugh! Attached is a pic of my iphone x right out of the box, i cant speak on anything else as i have not even turned it on.",3
att.com,iphone,Responding to comments from my earlier post. The iPhone X is just to smal especially if you are used to having the plus model iPhones like I have had. Why spend the extra money for Face ID and Animojis??? The new iPhone 8 and iPhone X have just topped the charts as the most fragile smartphones out!!! And they are by far the most expensive to repair. In my opinion they aren’t worth the extra money. I’m a true Apple fan but the new iPhones have let me down so I will be keeping my iPhone 7 Plus and jumping ship to the Samsung Note 8. I have faith that Apple will do the right thing and make a plus sized iPhone X next year but until then I won’t hold my breath,1
att.com,iphone,"Phone is all around incredible. Ridiculous 4K recording. Best battery i have had, better than galaxy s8 plus by a ton",5
att.com,iphone,"I love the screen and clarity. But I’m having a hard time letting go of my iPhone 7+. I thought the camera on the X would be as good, if not better than the 7+ and the flashlight is no where near as bright as my previous iPhones. Not having a button is actually a nice change. I Like the simplicity of swiping to open and close apps. The new iOS is an improved change too. The only issue is moving items around in settings. No one should have to google how to as an email account to an iPhone of they already own an iPhone. Nor should you have to open every tab trying to find where that feature has been moved. Overall, I like the X, but I’m still on the fence about keeping my 7+. I’ve got 11 more days before I have to return it. Hopefully the good will outweigh the bad.",3
att.com,iphone,The phone has a smaller size than other phones with the same size screen. The faceid is what sold me to switch back to an Iphone. It is a game changer for me. I hated to type in a code to unlock the phone everytime I used it. Not having an earphone jack has not been a problem for me. I am disappointed that the phone is much slower to charge than the Samsung S6 I had. The Iphone takes twice as long to charge. I hear the apple is working on a partial solution that will charge at 3/4 as fast as the Samsung. It is not a deal breaker. The new motions to operate the phone have not taken too long to get used to.,4
att.com,iphone,I heard all whistles and bells regarding the IPhone X and was a little bit hesitant of the needs to upgrade from my IPhone 6 plus. Unfortunately I dropped my IPhone 6 plus and now was to make a decision of fixing it or getting a new one so I ordered the new IPhone X. The delivery was fairly fast and by my surprised I was soon to find out that the upgrade was very much noticeable. This phone is the best IPhone ever and do bring a great advantage in the market. this is my experience I do not want to bring technical review but you should do your homework. I chose the 256GB considering that many apps are getting bigger the lower option might not be enough memory by the time I paid your phone off.,5
att.com,iphone,"The phone is larger than all previous iphones, however the screen is more narrow. When I watch landscape video, the screen size expands until it either hits the top and bottom, or the sides, or both (this is normal function), in landscape the video expands until it hits top and bottom and leaves over a 1/2"" of dead screen on each side. this means I am looking at a screen the same size as an old iphone 3 or something. it really really stinks. the narrow screen and resultant small landscape video size is a deal breaker. they can have it back. everyone I show this to is stunned.",1
att.com,iphone,"I switched carriers and the only great deal available was the iPhone BOGO. I have been a loyal Samsung user up until this and switched from the Samsung 8 to the X. I have to be honest, I don’t love it and HATE was the word the first 48 hours. I do like the music options and the camera a lot but other than that I can’t find anything else. Its just difficult to use. The things I could just do before, I have to search for an app now. App after app after app. I hope I will learn to like it but at this point I am counting the hours and minutes until I can get rid of it. If I had any option I would not have this phone.",2
att.com,iphone,The iPhone X is a huge step up from my iPhone 7 Plus and I didn’t expect that. I thought it would just be a nicer screen. But the processor is so much faster. Everything opens and loads instantly. The camera is stunning and the display is the equivalent of my 4K Samsung tv. I was a bit worried with the facial recognition but it works flawlessly. It won’t unlock until you make eye contact and if the phone is ringing it’ll turn down the volume when you look at the phone. Summary? So many fun little features and an amazing processor that never fails. Good Job Apple,5
att.com,iphone,"Upgraded from a 6s. Love the face recognition. Using the phone is different without a home button, but easy to get used to. I had to google a few things like how to shut it down, screen shots, and how to close apps.
The face recognition with Apple Pay is very cool. Face recognition doesn’t work unless your eyes are open and you are looking at the phone. So it feels more private than with the fingerprint scanner.
I chose the silver phone because it looked awesome. But the front and rear of the phone are glass. And it is super slippery. So I looked for a clear silicone case to show off the phone but also keep it safe.
Overall very happy with the new iPhone.",5
att.com,iphone,"Having had every iphone since the first, ands few Galaxy phones as well) I can honestly say that the iPhone X delivered on all fronts. The screen is exceptional to look at. The keyboard seems a little small coming from the 7 Plus. The notch is a non issue during use. Many apps have not optimized for the use of the entire screen and screen dimensions. I think in short term the little quirks will all be worked out quickly by the app developers and Apple. I am very satisfied with the speed of the phone. And the video and picture quality is top notch.",5
att.com,iphone,I was really hesitate on getting the IPhone X because I’m use to the bigger size like the Plus but since I have had the phone I have adjusted and I am loving it. The pictures are soooo clear and amazing I’m glad I went with this phone!!!,5
att.com,iphone,"I truly love the X. I have had many iPhones, and I upgraded from the 7 plus. This is better than any of them. I love the beautiful screen and the face id. It works as well as one would expect from Apple. The design of the phone is gorgeous and the size is perfect. I love the color choices as well. The camera takes fantastic photos and portraits. I’m an Apple groupie I suppose, because I can’t say anything bad about Apple products. The iPhone X is no exception. I’ve loved all my iPhones, and this is my favorite. Thanks, Apple, for such quality products!",5
att.com,iphone,"First: the buying process was painful - waited for nearly an hour for anyone to sell me the product. Then, all they tried to do was upsell, trying to talk me into things I didn't want - terrible.
As for the iPhone X, I like that the screen covers nearly the entire front of the phone. The cameras are great, and there are some other nice features.
On the downside, I would prefer a little smaller overall size - more like the iPhone 7 or 8. Also, the phone gets hot when making a call or other use for more than just a couple minutes.
Definitely overpriced but, I still bought 2 just because I wanted the latest model.",4
att.com,iphone,"I am no average reviewer; I worked as my companies phone manager for over 2 years so I have used every Samsung from S4 up to every iPhone ever made.
Pro’s - Great Display. - Size is perfect. The standard iPhone is too small but the plus is too big. - getting adjusted to no button was easy. - Battery lasts longer. - Animoji’s are cool and I know we will have some cool AR apps that yse this tech.
Con’s - Price is too steep - Fragile phone. Now I haven’t dropped mine but I did see the test on durability and this phone failed. - Lots of apps don’t use the full screen. - The keyboard is still too small. - Auto correct has a glitch in it, and cannot be used. - Animoji’s freeze or don’t work at times. - sound switching is still an issue - Facial recognition doesn’t work all the time. - Siri still isn’t very smart. I asked her what my email address is and she told me she ran into a problem. - Copy and paste still isn’t better than the Galaxy. - Finally price. This phone has an inflated price point.",3
att.com,iphone,"Had a 6 was forced to upgrade to the 7..... the change was.... meh.... the iPhone X is a different animal, heavier... much better looking and with a stunning display that exceeds the size of the 8+.... camera quality is amazing compared to the 7.... people complain about a high price tag when a flagship Samsung is very close .... ;) Apple all the way, quality, finesse and style.... also a phone that will last me 5 years",5
att.com,iphone,"Short and sweet, this is absolutely the best of the best. I love Face ID, the OLED display, 256 Gb, memory, the camera, Animojis,
the size and everything you’ll read in every other 5 star review. IPhone X is a gorgeous phone, it does everything it’s supposed to and fixes are coming super fast for anything it’s not supposed to do which has only been one thing that I can think of. Yes it’s worth the $3.00 more than I paid for iPhone 7 Plus...I have ATT Next and that’s all it comes out to. It’s an awesome phone and I really love it!",5
att.com,iphone,"First off I’ll be an Apple Head forever but the X was for a lack of better terms, a disappointment. I come from the iPhone plus family. And after being used to those phones the size of X was shocking. It’s too hard to get used to a smaller phone after we’ve been accustomed to the size of the plus variety. I recently gave my X back in exchange for the 8 plus. The only difference is the face recognition and the Animoji features. When the X plus comes out I’ll b first in line but for now the 8 plus suits me just fine.",2
att.com,iphone,"As I stated in my first review, the screen is too small on the X, about the size of the iPhone 7. I know the specs say 5.8"", but there is an upper and lower part of the screen that acts like a bezel and is not used. I had to set the AT&T sales people straight and show them the 8 plus has a bigger screen! The keyboard is quite larger on the 8 plus, as it is wider!",3
att.com,iphone,"I am one of those folks upgrading from a plus device (6S plus), so the smaller form factor took some getting used to. The phone is definely narrower but the screen is big and beautiful and to me the size of the phone is perfect. I was mainly concerned that face ID wouldn’t work as well as the finger print reader. It works great! (Makeup, no makeup, glasses on, glasses off, hair up, hair down). It recognizes me and can tell the difference between my daughter and me (we look a lot alike) easily! The phone itself is gorgeous, it’s a shame to cover it up with a case. But it is glass, and I watched all those dropping videos showing how bad they shatter when dropped, so I will definitely use a case. The OLED display is amazing. Colors are definely truer, and black is really really black. I thought the notch would bug me, but it doesn’t. Overall very very happy with the phone and feel lucky to have received it on launch day!",5
att.com,iphone,I love it there is a little learning curve but I love it. It’s a little smaller so it fits in my pocket better without hanging out. The screen size is a tad bigger than the plus without being bigger. The face recognition is wonderful. The colors are much brighter and the speakers are better with more volume. The camera has more features than before. They did a great job with this phone. The only bad thing that I heard about is make sure you have a good case on it cause it doesn’t do well if dropped.,5
att.com,iphone,Love the phone and it’s upgrades however it is so fragile and difficult to find a minimalist drip proof cover to cover all of the front screen including over the raised glass (fragile) to meet where the screen saver ends. I don’t know why Apple chose to design it this way. Also as it is made of glass on front and back I would think more of the aforementioned cases would be available but they are not. I used to love Tech 21 but they don’t fit bc of the front screen design. Also it is so small I have difficulty locating it esp in my purse after using my Uphone 6SPlus and I wish they offered it in the Rose Gold color.,4
att.com,iphone,"While I was ready for an updated iPhone since my 6+ the reviews made me hesitate. All poppy cock! You will not miss the home button or the frame surrounding the screen. In fact, not only do you gain more screen real estate than a plus the iPhone X is narrower and fits easier in the palm of your hand! Furthermore, the face recognition feature is faster and more natural to navigate than the home button. I adjusted to the change in less than a minute. Sexy to hold, navigate and see with a camera/photos that will blow you away. Joy to the world. Thank-you Apple!!! LOVE!",5
att.com,iphone,"I am so in love with this phone! The camera is amazing! If you use the portrait mode under the actual camera app it takes the most amazing pictures! The face recognition is awesome especially to able to use it to sign in to everything on my phone including banking. Another cool feature is that I have ATT home internet which came with an extremely long pointless WiFi password, my friend went to log in to my WiFi the other day and it alerted me on my phone and asked me if I wanted to approve her, then it connected her right away after I hit accept! Such a time saver! Love it and completely worth the money!",5
att.com,iphone,"I came from the 7 plus, the OLED screen and aniemoji interested me highly. Once I got the X, it was a learning curve getting used to no home button and I loved how smooth IOS devices are but this phone I’ve had for about 4 months and I hate how I’m multitasking that it has to reload tasks constantly due to the 3GB of ram. The worse part is when the phone decides to randomly restart every once and a while, the back glass scratches super easy with light use and battery life is ok. I hate the face unlock because I’m the morning it doesn’t recognize you when your on your side laying down and definitely miss the fingerprint reader. I don’t think it was worth the upgrade or 1k price tag so to speak, and I’d say stick with an 7-8 generation of iPhone.",2
att.com,iphone,"I was hesitant on purchasing the new iPhone X, I thought the lack of a home button and the new Face ID would be a disappointment. Days before receiving it in the mail I wanted to cancel My order because I was convinced I would not like it. Every time I used someone else’s x I had trouble understanding its functionality. One day after transferring over the the x I couldn’t be happier. It really is the most amazing phone. Everyone that had one was trying to explain to me how amazing it is but the point is you can’t explain it. You just have to use it. It becomes an extension of you.",5
att.com,iphone,"Having upgraded to every iPhone made since 2002, I was massively disappointed by my experience with the iPhone X. It feels extremely uncomfortable in my hands, and the face rec is literally awful. The battery life is not any better than recent phones, the screen is fine but not a huge step forward, and I can’t reach the entire screen without moving my hands. I’ll be moving back to my iPhone 6s for the time being, and considering my next move. Can’t believe I have to consider another manuf...",2
