source,phone,review,rating
att.com,iphone,"I love my iPhone X , it’s taken me longer to find out to use it. The salesperson at AT&T didn’t have patience in helping me transfer my contacts, etc. like he didn’t want to help me.",4
att.com,iphone,"Supermachine: working horse, no extra button on the middle of the screen. Fast, elegant view fill solid and easy to operate. Super camera in any environment with a lite condition.",5
att.com,iphone,Coming from a Galaxy S6 active I was skeptical. I absolutely love this phone. It has been simple to adjust to using and by far has exceeded my expectations. I really like this phone.,5
att.com,iphone,My older Iphone was acting up something terrible. It is paid off. So I got the X instead of the 8 because of the size basically. Wanted it to foot in my smaller bag. Love the speed.,5
att.com,iphone,I purchased the IPhone X and an IPad. That was the best deal ever. I walked away with not only my IPhone but also an IPad which is what I had been wanting for a while now. I love it,5
att.com,iphone,Very impressed thought I would miss the home button but not at all!!!! By far the best phone I have ever had. Was scared because of bad reviews but they were all wrong! Great phone,5
att.com,iphone,I thought that going from the iPhone 7 to the iPhone X would be a difficult transition. I couldn’t have been more wrong. The iPhone X is easier to use and the apps work flawlessly.,5
att.com,iphone,iPhone X is a step above the rest in terms of camera and screen! Videos look awesome and wireless charging is super convient! Expensive device but At&t always has awesome promos!,4
att.com,iphone,It took me a little while to get used to no home button But I am swiping like a pro the facial recognition is way better than fingerprint id and the photo quality is unbelievable,5
att.com,iphone,"It’s basically a more badass iPhone than the previous models. You want the latest and greatest, get the iPhone X. Face ID is just one of the many features that I personally love.",5
att.com,iphone,"Voicemail does not work. Just a shame. Year 2017, latest IOS - this is greatest embarrassment I could've imaging. Had problems with contacts and backups. Bad error processing.",2
att.com,iphone,"been meaning to try the I phone for a few years, finally decided to make the switch and so far have been satisfied. still a lot to learn. plan to get some tips on its operation.",5
att.com,iphone,Haven’t had an iPhone for awhile but I am glad I came back to them. Operating system seems to be top notch and new features are fun and easy to use. Over all good phone so far.,5
att.com,iphone,"I Love how I can monitor what my child is doing on her phone,and how I'm able to see what games she downloading,and etc. I also like how I can monitor her location @ all times",5
att.com,iphone,"Got a great trade in price for my old iPhone 7, and upgraded to the IPhone X, actually all three of us did, have had our phones for a week and I am in love! Worth every penny!",5
att.com,iphone,This is my 4th iPhone. Definitely each one has made great improvements. Love everything about the phone including the shiny silver. I think it’s a classy phone. Great photos!!,5
att.com,iphone,"So many great things about iPhone X. I debated upgrading, but am so glad that I did. I’d recommend this phone to anyone who is looking to upgrade or switch from an android.",5
att.com,iphone,"IPhoneX is absolutely incredible, ANY bad reviews must be from people who either don’t know what they are doing or have buyers remorse because it’s costly, but it’s worth it.",5
att.com,iphone,This is by far the best iPhone apple has ever came up with! It has everything an iPhone does and has those features of the Samsung we always wanted all wrapped up in th X!!!,5
att.com,iphone,"It’s such a beautiful phone! I absolutely love the silver color!!! Getting used to the differences does take some patience, but I’m so glad I made the decision to get it!!!",5
att.com,iphone,Takes some getting used too specifically the size coming from the 7 plus. The more I use it the more I lean towards this probably being the best iPhone ever in my opinion.,5
att.com,iphone,This is my first smartphone & I am very happy with all its versatility & ease of use. I am not electronic savvy & this device was intuitive which facilitated my use of it.,5
att.com,iphone,So far i like the phone Do I recommend it to other people yeah so from my mom likes it I just picked the wrong color I want to space gray for the most part it to get phone,5
att.com,iphone,Its an okay upgrade. Wasnt to excited about all they say it can do. You gotta load all the PAID apps to allow most of its features to operate. NOT WORTH THE $$$$$$ spent,4
att.com,iphone,I wish the phone came as a plus but I like it. Apple has out done themselves once again! Great features & the face ID is pretty cool. And the camera is freaking awesome!!,5
att.com,iphone,I love everything about this phone. The face ID is amazing. I love the swiping gestures that replaced the home button. The display is beautiful as well as the camera.,5
att.com,iphone,I love iPhone but nothing about it screams that it’s worth the money spent. My iPhone6s does the same things except for the little talking emojis and facial recognition.,3
att.com,iphone,I’ve only owned the phone for a week and so far so good. The camera on the phone is a big step up from my 6s and there is a very noticeable improvement in battery life.,5
att.com,iphone,My rating is based mostly on value of purchase. There is nothing really new to justify the price in Apples latest version of this phone. Face scratches easier than ever. The camera is OK. Fine for web work but not yet worthy of printing except under limited conditions. This was really disappointing but it is nice to be able to focus more like a camera. For younger users this concept is probably new but for me it’s way overdue and works ok. I prefer the old button interface. IT WORKED BETTER Apple. (even with the loss of screen). The new interface remains so-so after six months of using it. I’m good with it if it improves touch accuracy. The X is far wonkier when it comes to arranging/erasing apps. Forgone conclusion the phone is extremely slippery but of course who doesn’t use a cover these days. There’s nothing wrong with this phone and it has some great qualities but knowing it’s made by slave labor to huge profits without any major improvements the price is simply ridiculous. I regret buying it and have encouraged my daughters to check out Googles phones. Sd (apple guy and cell phone user since the 80’s. ),3
att.com,iphone,I did the upgrade as a Christmas & Birthday gift to myself. Still learning all of the ins and outs but so loving the new unlock system .... FACE RECOGNITION.... XOXO,5
att.com,iphone,Bought the I phone X for my wife so far not impressed. Everytime I FaceTime her the phone freezes up for at least 6 hrs. Think I will return the phone for a iPhone 8,3
att.com,iphone,I love my new Apple iPhone X. It works great and is easy to use. I especially like the face recognition in order to get the phone unlocked. Camera is great also!!,5
att.com,iphone,"I love the 10, the screen is bigger, the help options are easily accessible b/c you don't have a home button. The phone has so many cool feature like live wallpaper.",5
att.com,iphone,"Love it! It's taking some getting used to using facial recognition while using Apple Pay, clicking the side button twice first is awkward. Otherwise, it's great.",5
att.com,iphone,I love new iphoneX it’s technology is undisputed it’s my little personal computer away from home. Crystal clear images and beautiful pictures i can’t put it down.,5
att.com,iphone,By far the best iPhone made to date. Transition to face recognition and lack of home button was super easy and took very little time to adjust to. Simply awesome!,5
att.com,iphone,I just got my nex iPhone X and I’m excited about it. It has some features that are great and make things easier. I’m still learning about it but so far I love it.,5
att.com,iphone,Been an iPhone user since the beginning and now it’s even better than before. Enjoying the new features and cool gadgets that it came with. Worth the purchase.,5
att.com,iphone,I adjusted to the no home button issue easily. I also love the speed and all the neat features- still learning with new surprises every day. Love this phone.,5
att.com,iphone,"I have thoroughly enjoyed this new iPhone. The face recognition makes access so much easier. I use this for all aspects of my work, and I couldn't be happier!",5
att.com,iphone,"This iPhone is what I’ve been waiting for! It’s a DREAM!! The stability and quality of Apple, yet it is SO easy to navigate and the Animoji’s are AWESOME!!!",5
att.com,iphone,"i upgraded from I Phone 7 plus, so far i really like the phone, love the features, the camera is awesome, the face detection is great, i recommend this phone!",5
att.com,iphone,"Much better then I thought, easy set up and automaticity moves you along. It has much more then I have even seen so far. 64GB handles all my needs very well.",5
att.com,iphone,So far il lovei it. It was a little hard to get use to no home button but once you do its really easy. I dont usethe face recognition bc id like passcodes.,5
att.com,iphone,"I was contacted by a recruiter to write a review for the iPhone X. The primary drawback to the phones is how slippery the phone is, having reached a tota of",4
att.com,iphone,"I wasn’t sure when I first got this phone. I moved from an iPhone 7plus to this, and it looks smaller at first. After I made the switch I couldn’t be happier",5
att.com,iphone,Like to iPhone X. It runs fast but if can have an option to use the fingerprint recognition will be better. Apple should consider that for the next release,4
att.com,iphone,"It feels the same as every other iPhone I received. iPhone 6s is a great phone and I regret paying this much money for an iPhone, I will never do it again.",3
att.com,iphone,I’m surprised it didn’t have better features. I switched from the galaxy s8 to the iPhone X and the galaxy had bed features and was way more customizable.,2
att.com,iphone,Love the privacy feature of face recognition. The phone is fast and the size is perfect. The larger screen makes possible for the phone’s better handling.,5
att.com,iphone,I was worried about the no home button. It was very easy to adjust to after my 7 caught fire. The speed is great and the camera is amazing! Great device.,5
att.com,iphone,Difficult and slower to open my apps and get where I need to go. Very aggravated with it daily. Wish had gone with a 8 plus. Size is great. Very Unhappy!,2
att.com,iphone,"The phone freezes up quite often, did a update on it hoping It would fix the problem, but it did not. Other then the freezing up the phone is pretty cool",4
att.com,iphone,This is by far the best phone I have had. I don’t see why people are complaining about the notch at the top of the screen. I really don’t notice it now.,5
att.com,iphone,"Wonderful Technology...! My daughter is happy to have her iPhone X. I see and play her iPhone X for short time, NICE....! Better than my iPhone 5SE.",5
att.com,iphone,"I love this phone❤️. Facial recognition, voice mail feature where the message is printed on the phone, ease of using the phone - are the pluses for me!",5
att.com,iphone,Excellent phone. I will definitely recon this phone if you are shopping for a new phone device. It handles my at home life ! My work life! All in one.,5
att.com,iphone,"The screen is a flaw by design. It should have been a rectangle by default, why would some watching video or taking photo would see cropped content.?",3
att.com,iphone,I have been using iPhone since 7years. But this time I am Facing lot of issues in screen rotations & Face ID is bit slow. Not up to the expectations.,3
att.com,iphone,I upgraded from an Iphone 6S to an Iphone X. The difference in the quality of the camera is amazing. The battery life of the X is also really good.,5
att.com,iphone,Overall the phone is good with top notch cematics I prefer a larger screen but I have experienced a lot of dropped calls since having this new device,4
att.com,iphone,"I love everything about this phone. Amazing screen, pictures, multitasking. It takes about a minute to get used to not having a home button. Love it.",5
att.com,iphone,"My iPhone X is an awesome device. Love the new features. I get a lot of compliments on how it looks. As my daughter would say, it’s the bomb.com. lol",5
att.com,iphone,"Didn’t think that I would like this phone when I first got it but I so love it now. Still getting use to the size. Much small than my IPhone6s plus,",5
att.com,iphone,After receiving my iPhone X I found it to be a lot easier to use than I thought it would be. I have had it only a week and I consider myself a Pro.,5
att.com,iphone,"It’s okay. Trying to get used to not having the home button. Face recog is nice, but haven’t noticed much else that’s better than the 6sPlus I had.",3
att.com,iphone,iphone x is a great device over the other iphones but i really should of stayed with my matte black iphone 7 the X is just an over all better phone,5
att.com,iphone,Impressed with the phone and its new features. The camera features are particularly impressive. The new text animated icons are fun and exciting.,5
att.com,iphone,The new iPhone X is more just a great phone. AT&T paired with the iPhone X it almost like the two are a step ahead and ready for your next need.,5
att.com,iphone,All my life I had been an android user but once I made up my mind to get the iPhone I couldn’t be happier. The only problem I have is the music.,5
att.com,iphone,I HATE not having a home button. I wish I could trade it in for an 8 Plus. It would be so great if I could trade it back in and get tbe 8 Plus.,2
att.com,iphone,Love the new screen. It takes a couple turns to get used to not having a home button. Phone works great. Be sure to purchase a wireless charger.,5
att.com,iphone,Fantastic device.... love not having a mechanical home button. Perfect size for me (male 65) viewing area on screen much better than 8 or 8plus.,5
att.com,iphone,"I received iPhone X and package was incomplete I opened the box and the accessories were missing, no charger no adapter or earbuds totally upset",3
att.com,iphone,I have had the phone for s week! It freezed up once but in looking on line my Grandson was able to fix it. Since then it’s been working great!,4
att.com,iphone,The iPhone X is amazing. I love the ease of use. It definitely makes my life so much easier and I wish I would have been able to get it sooner.,5
att.com,iphone,Only had it about a week but it seems to be great. Very easy to pick up all of the new features. Seems like I’m still learning more every day.,4
att.com,iphone,"I am in love with my new iPhone X! I have always liked my new iPhone when I upgrade, but this one has surpassed any others. I’m very happy.",5
att.com,iphone,"I like my new iPhone, no complaints. If I wasn’t charged 4 times for Direct Tv NOW. I would’ve been more thrilled with my overall experience.",5
att.com,iphone,I haven't been this excited about an iPhone since my first one (3G S). Super easy to use as always and the camera improvements are fantastic!,5
att.com,iphone,"I love it!!!! It has a larger screen and I love the ""face recognition"" to open my phone. It is so easy to use!!! I love the silver color!!!!",5
att.com,iphone,I think that it’s really neat that it defaults to private previews of notifications until it catches you on FaceID with longer battery life.,5
att.com,iphone,I have been an android user for 9 years. Switched to Apple. I can’t believe how user friendly this phone is!! Love how it takes pictures too,5
att.com,iphone,I will never own anything but an Apple product! I always buy the highest GB and it never disappoints. If you have the money get the best!,5
att.com,iphone,I love the iPhone. My only gripe is waiting for shipping but this phone is a amazing. The AT&T rep Hosh was so helpful and that was amazing.,5
att.com,iphone,I absolutely love this phone! I didn’t want upgrade my iPhone 7 Plus to a smaller device but I did it and regret waiting this long to do so.,5
att.com,iphone,This is the best phone what I have ever . It’s very quick make good picture and of course have more room . And plus battery it’s forever !,5
att.com,iphone,It’s truly and amazing phone I thought it would be horrible but you have to try it out yourself to enjoy it befor you give it bad judgement,5
att.com,iphone,I love it love it love it. All the hidden tips and tricks there are makes the phone fun. Yeah I said fun. The phone is fun to have and use.,5
att.com,iphone,My son (18) ready to go to college.. loves it and will be very useful tool for school. He’s a film and art major .. the camera is awesome.,5
att.com,iphone,I was worried I would hate the changes but it great !! Went from a 6s to this and it is awesome! Camera is unreal and I love the Animojis,5
att.com,iphone,"The I Phone X fits perfectly and securely in my hand. It’s so fast, clear and bright. Today I us d the video and OMG! Clear and precise.",5
att.com,iphone,The new iPhone X is a beautiful clean bright design. The new display is gorgeous. The new functions are intuitive. Battery much better.,5
att.com,iphone,iPhone X is absolutely wonderful. It has things much better than iPhone 7 we traded in. We bought 2 ea one for my wife and one for me.,5
att.com,iphone,"Swipe has issues that an update has not fixed, recommend waiting for the iphone X plus which should be out next fall (it always happens)",4
att.com,iphone,"Works as expected. Too pricey. I dont like the ""rule"" that you can't pay for the phone at time of purchase and it has to go to payments.",4
att.com,iphone,My iPhone is my friend! Connects me with people important in my life while keeping my most important info secure. It is also just fun!,5
att.com,iphone,"Fantastic phone, the best I’ve owned yet. Love the full gesture control. So much easier to navigate and use. The best yet in my opinion",5
att.com,iphone,Upgraded from an iPhone 6. Love the X! You get used to no having a home button in 20 minutes. Face ID is great. Very fast. No regrets.,5
att.com,iphone,The X is awesome. Love the new features and the camera is amazing! Takes a little getting used to but it’s much simpler once you do.,5
att.com,iphone,"Confusion why they changed to Roman Numerals for this one, but; one step closer than not having to think what you want the phone to do",5
att.com,iphone,I am enjoying this new phone. The safety features of the facial recognition is truly awesome. I highly recommend purchasing this one.,5
att.com,iphone,I’ve fallen in love with yet another Apple product! This is my 6th IPhone over the years and They just keep getting better and better!,5
att.com,iphone,The is a very nice phone and im glad I upgraded.. camera and battery life is great but i do feel my phone service and internet is slow,5
att.com,iphone,Not 100% satisfied with this product. It could be better than its competitors but it is not. My husband and kid absolutely loves this.,3
att.com,iphone,I’d like a facial recognition but I don’t know about the processing speed and Apple still has to do something with your voice to text,5
att.com,iphone,"I absolutely love this phone! I can set reminders , list to do things in calendar or in notepad. It does everything better and faster",5
att.com,iphone,Love my new iPhone X. Camera is the best yet . Very easy to use and glad there is no home button . Just something that always breaks.,4
att.com,iphone,"Really enjoying everything about the iphone x. The camera is amazing, the face ID is so convenient and it's much smoother and faster!",5
att.com,iphone,I have had this phone for about 2 months n I love it n can’t get enough of it it’s got a lot of cool features n I got my bff to buy 1,5
att.com,iphone,Only had the phone about a week. Seems to be ok. I don’t like the fact that it is smaller than my 6plus. I do like the camera on it.,3
att.com,iphone,"Glad to have the new iphoneX it is fast and very clean looking ! Had a Note 8 , glad the freeze machine is gone , back to apple !!!",5
att.com,iphone,I really like the phone. The camera rocks. No home button is very nice and the touch functions make the phone even easier to use.,5
att.com,iphone,"Very nice phone. Price is a little high, but is worth it in my opinion. The slick design is just stunning. Functionality is superb.",5
att.com,iphone,I JUST LOVE THE SMALL VERSION OF THIS IPHONE WITH THE SAME SCREEN QUALITY AS A PLUS LITTLE BIGGER I SHOULD SAY BUT ALL IN ALL GREAT,5
att.com,iphone,Love my new phone. Wasn’t sure if I would like that it didn’t have a home button but I really like it. Love the portrait pics also.,5
att.com,iphone,"Seriously the most fun I’ve had with a phone. I know Samsung has similar phones, but I’m too firmly planted in the Apple universe.",5
att.com,iphone,"Smart phone that is truly a one handed smart phone. My only gripe as always, is the inability to expand memory with a memory card.",5
att.com,iphone,"Learning to change over a phone and phone number is always a headache, but it was realitively a easy process with the new iPhone X",4
att.com,iphone,I’m loving this actually. So easy to use. Learning more everyday I use it. Way to go Apple. You’ve done very well with this one,5
att.com,iphone,"This thing just does everything well and as with all Apple phones there simply is no match for their features, apps and functions",5
att.com,iphone,"Was a d bout android user,preferably Samsung.Had so many Robles with my 7edge that I decided to give igneous a try.So far,so good",4
att.com,iphone,I did my research and went to see if all the problems I read about were fixed and they were. I have had no issues with the phone.,5
att.com,iphone,Love the facial recognition over the finger print especially when logging into apps very pleased with the upgrade from the 7 plus,5
att.com,iphone,"Love the facial recognition feature,! Lots of great new features. Works great. It’s also an awesome hand held computer. Love it!",5
att.com,iphone,Would recommend this phone to anyone. I also have the galaxy s9 plus and I’ll say the iPhone X is the best phone on the market.,5
att.com,iphone,"My new iPhoneX is great, it’s a perfect upgrade from what I originally had. I’m loving the new style and performance. Thank you",5
att.com,iphone,"This X is amazing! Face recognition & no home button are grest features. Slim, sleek look with all the great Apple technology!",5
att.com,iphone,Thought it was going to a little difficult to get use to since there was is not a home button. But real simple to figure out.,5
att.com,iphone,I like it not love yet but it is an iPhone!!! It takes getting used to (some features) but no complaints from the iPhone lover,5
att.com,iphone,My first iPhone ever and I love it I will not be going back to android so much faster and more reliable than the android phone,5
att.com,iphone,The iPhone x is the best smart phone in the market. Face id is revolutionary. I would say this is 100% worth the given price.,5
att.com,iphone,Very happy with the purchase. I take a lot of photos for my companies social media and it has already made a huge different.,5
att.com,iphone,"Got this for free along with my 257GB iPhone X, for my mom. She’s happy with it while she’s still learning the new features!",5
att.com,iphone,"I’ve had every iPhone since the iPhone 3GS and the iPhone X is been best! I love the full screen, Face ID, and new gestures.",5
att.com,iphone,I love my new phone thought it was going to be a pain to transfer all my stuff from my old phone but I had no problem at all,5
att.com,iphone,Great screen. The camera and supporting hardware is far and away the best feature of the phone. Very fast hardware overall.,4
att.com,iphone,"It’s a great phone. Tons of storage and easy to use. It took a little getting used to, but it’s still very user friendly",5
att.com,iphone,I absolutely looovvveeee my X. Fits my hand perfect!! There’s nothing I don’t like about this phone! Definitely worth it!!!,5
att.com,iphone,"It’s better, but not by much comparing to Iphone8+. I was looking for something extravagant about it but I cannot find it.",4
att.com,iphone,I’ve had my I phone about a week now and really like it! My son and daughter also upgraded their I phones and love theirs.,5
att.com,iphone,Although the phone isn’t as big as I would like - it definitely has amazing features and a clean new design. I love it!!!,4
att.com,iphone,"Love this phone. I had an 7 plus before. I’m still getting used to face recognition, which is so cool. Love the Animojis!",5
att.com,iphone,"Great phone, smaller form factor with a bigger screen, can Text with one hand once again, yes without shifting screen lol",5
att.com,iphone,A very intuitive and high tech features makes the iPhone X enjoyable to use and fun to experiment with innovative ideas.,5
att.com,iphone,"Very nice phone, not quite worth all the fuss....or the price Face ID is nice but not much better than fingerprint I’d.",4
att.com,iphone,I’m still adjusting to the no home button but overall I love the phone. Price is ridiculous but I upgraded regardless :),4
att.com,iphone,I am an 84 year old and I just love this IPhone X. Best of all is the face recognition and being able to use Apple Pay.,5
att.com,iphone,It’s a great phone. Less bulky than the plus. I wish it came with the wireless charging pad but it’s not even out yet.,4
att.com,iphone,Great product. Have enjoyed all the additional capabilities the iPhone X has. I recommend this new phone to everyone.,5
att.com,iphone,I have never had a phone plan with anyone .. I’ve always used straight talk . Glad made switch the I phone x is great,5
