source,phone,review,rating
att.com,iphone,"I had my phone for a week so far I’m not impressed with the service I’m getting I’m not sure what’s going on it always searching for service when trying to use the internet or social media, even in the city I have issues with it loading today I recieved a text message 40 min after it was sent to me, my iPhone 6pus had better service than this one, going in tomorrow to see what att could do about it or return it",3
att.com,iphone,"This phone is SUPER fast. If you think it the phone will already complete the task. The touch screen is awesome and great display. I do NOT miss the home button at all. Face recognition is SUPER fast and more reliable than finger print. The only issue is that you have to hold the camera just right for it to recognize facial id, however the only time this is an issue if the phone is on a desk or something.",5
att.com,iphone,"Was a little insitated to change my iPhone 7 Plus for the X. The best decision ever. At first was confused always looking for the home button. But after a day, I dont even miss it. So flawless and smooth, everybody complements the phone and pictures taken with this phone. Also don’t need to recharge the phone during the day, the battery last the entire day even using social media and texting a lot. Love it.",5
att.com,iphone,Don’t do it Don’t buy it Don’t lease it,1
att.com,iphone,I upgraded from the iPhone 7s. It is definitely a better model iPhone. The battery is a major upgrade and I love that it stays charge so much longer. The facial recognition is different from the thumb scan but it’s not a negative feature. The only thing that’s an adjustment is the way to take a screen shot. Sometimes I accidentally take screenshots. Other than that it is a lot better than the iPhone 7s.,5
att.com,iphone,"Just not really worth it. I upgraded because my 7 broke...hard getting used to the new operating commands and the size is larger than necessary...it’s a phone, not an iPad. Anyway, no other real surprises...just more of the same...",2
att.com,iphone,"Upgraded my 8 plus to the IPhone X everything I expected it to be but for just one shortfall.... Battery life.... Slightly smaller feel in comparison to my former 8 plus even with my Otterbox case...easy navigation, the facial recognition is a great plus and no more fussing with the finger ID. And of course the Great Service and personal attention you get when you go to your Corporate AT&T Store.",4
att.com,iphone,"I got the phone as an upgrade from my 7 plus. I am usually super impressed with the new phones. This one, not so much. I am not a fan of the camera nor the buttonless screen. I also was very comfortable with my the size of my old phone.. but the X is just weird. I havent been a fan of recent apple products, and I guess I am not a fan of the new phone either. Maybe if there was a 10 plus? Who knows?",3
att.com,iphone,I cant say many thing good abut this phone nothing wrong with phone i thing software not like befor i mean i phone 7 was the best after 8 and this have many problam when i have i phone sevan evan last five month dont good.,1
att.com,iphone,"I was very reluctant to buy this phone because of some negative feedback on the missing home button, the new Face ID recognition etc etc. I got so used to not having the home button that this new swiping as a hint me but is way better besides that the screen is all the he way around. In addition, the face recognition is great to sign on to all my accounts. I recommend the IPhone X. Great phone.",5
att.com,iphone,"This is a great new phone and the path to the future. Cool new features (I know Samsung had most of them already), but now Apple does it with flair. If you don't like change, you wont like it, but get used to change!",5
att.com,iphone,Love the phone it has great battery life !! Nice and sleek fit!! Face ID is super amazing quick and easy to access the phone. The switching around of the features definitely gives it a level up its still the same iPhone just with a twist it made it fun to relearn the functions of the X. It made the experience new completely. I am taking it for what it is and enjoying it Apple is truly THE BEST,5
att.com,iphone,It is hard getting use to the New IPhone and it’s features so many to choose from but now that I have gotten use to them I am absolutely in love with it and if you come right down to it it’s the best IPHONE EVER if you reading this definitely buy it and Apple isn’t playing me to say this I have always had an Android phone and I like them but my Iphone is the best phone I have ever had !!!!!!!,5
att.com,iphone,I absolutely LOVE my iPhone X!! The face recognition is extremely fast! Then only thing I don’t like is after the face recognition unlocks the phone you still have to swipe up to open the phone. The processor is extremely fast! I don’t like how small the phone is. The notch doesn’t bother me at all and not having a home button took maybe 8 hours to get used to. Overall a great purchase!,5
att.com,iphone,"I’ve always evolved with the sizes of the iphones over the years. I just switched from my iPhone 7 to the iPhone X. It’s prefect, I could never get feel for a plus that feels like a mini iPad. So the C is just right. Getting us eto the changes as well. I love how sleek it is and I have a case that doesn’t hide that. Overall I love my new phone and I’d recommend it to fellow apple users!",5
att.com,iphone,"Not impressed at all with the x, I’m miss my 6plus may be trading it back in and try the moto, I like their accesorie option. Apple need to step their game up... I give it a 6 out of 10 at best",2
att.com,iphone,"Love the camera on new phone. Of course, night photos are still not good but they day ones are perfect. Screen and size of the phone is perfect. I was little concerned about not having button but it is super easy to transition. Another con is that some of the applications don’t seem to be adjusted for the X, like viber and cannon app I use for my camera, other than that, awesomness :)",5
att.com,iphone,Why is it smaller than a plus? I don’t get it. Even the face recognition gets annoying. Not my smartest purchase.,1
att.com,iphone,If you’re looking for something new.... don’t spend the money on the IPhone X. Get the 8 or stick with your 7 Plus. Not enough features to warrant the cost of. Save the money and take a cruise.,3
att.com,iphone,"The phone is great! I can do everything I have in the past with my other phones, but now I don’t need to use my finger to punch in a code or to use my finger print. At first it feels weird to hold a smaller unit compares to the iPhone Plus models, but surprisingly the screen is bigger... mind blowing!
I can go on and on, but it is best for you to get your hands on one and enjoy.",5
att.com,iphone,I am going to return it and get the 8 the only difference about this phone is the home button is gone and the facial recognition. Since I am use to the the Plus this phone is also too small.,2
att.com,iphone,"I absolutely love my phone! It's so fun and so glad I finally upgraded. With all my facial changes (make up, eye glasses etc) I noticed that my phone doesn't unlock all the time like it's supposed to or like it did initially at least. That's slightly disappointing.. Although the camera quality is REMARKABLE. The design and sleekness of the phone is great. Glad i made the decision.",5
att.com,iphone,I usually don't write reviews and how this helps someone out. I've had iPhones since the very first one and battery life has always been the biggest issue for me as I use my phone all day for work. But the iPhone X has an incredible battery life. Now I can use the phone all day and at midnight still have around 30-40%. That alone justifies the price these things cost these days!!,5
att.com,iphone,"The new X is well worth the money. Very fast and the new additions are very fun. Just wish with all the money the X cost a customer,that Apple would offer air pods or a better headset",4
att.com,iphone,Excellent phone works really well especially in the dark the face recognition is amazing. compared to the other phones they did it a little better on the battery. love this new phone.,5
att.com,iphone,"Apple iPhone X is a great phone. Specially when facial recognition comes in handy with Apple Pay in certain places. Also, I like the fact the screen is bigger for my huge hands! Also, I like the fact how, I’m not over hitting letters when I actually meant the other letter. I like how the flashlight when I turn the phone on to get light for walking in the movies comes in handy.",5
att.com,iphone,"I’ve had the iPhone 3GS 4s 5c 6+ 7+ and now the X. It’s the best one of all of them. I had issues with the 4s battery, 5c build 6+ and 7+ being buggy and have had no issues with the X. It remind of the 4s solid premium feeling phone good weight to it ...faceid is great I can’t imagine using touchid ever again. My only gripe is the notch I hate it but other than that it’s great",5
att.com,iphone,I went from an iPhone 6 Plus to the iPhone X. The display and sound quality from the phone is awesome! I love the Face ID and Animojis! Switching was definitely a good choice.,1
att.com,iphone,Face recognition is awesome. Love the screen and the size is just right.,5
att.com,iphone,"Great phone, very quick with a slight learning curve. It does everything they claim! Great sound, I replaced my 6s with it and the difference feels like a decade! a bit on the expensive side, I was needing a new phone and my gut tells me another Xs or 11 is coming soon...the price for the newest technology I guess. Def a great buy, it lives up to the hype if you have the $$$",4
att.com,iphone,"Can’t think of any flaws in this iPhone X. Speakers and sound are perfect. Typing ability-smooth and easy and accurate. User interface very intuitive and powerful and efficient. Camera is Also wonderful with super clear and beautiful photos and videos. Very easy to use functions. Beautifully clear, bright and large-enough screen. Love the 256gb storage. Sharp looking design.",5
att.com,iphone,"Big upgrade over my IPhone 6s, but very pricey. Needs to have lower price, Apple isn’t hurting that much. Notch on top is very distracting, needs to go on future models. Apple needs to figure that one it. Pretty loyal Apple consumer, nice to upgrade but could have had a lot more improvements. Also needs to incorporate a stylus like Samsung, believe me would sell like crazy.",4
att.com,iphone,"Perfect phone for most hands, great display, very fast. Make sure to buy a good cover and screen protector, 'cause if it is dropped, it isn't going to be cheap to fix.",5
att.com,iphone,"Like all the other iPhones that I've owned, this phone functions perfectly. I've even got used to working without a home button fairly quickly. My only negative opinion at this time is the missing zoom for texting and the icons on the home page. That was a great feature on my other iPhones and can't think of a good reason why this feature was discontinued on the iPhone X.",4
att.com,iphone,"I was worried about the price and size since my last phone was 6 plus, but actually kind of nice to go smaller. There is a greenish hugh around edge but I think it's from the glass. Doesn't seem to effect anything. Not sure if it's a flaw? Been looking on reviews but no one has posted an issue with it. Face recognition is nice. All in all nice phone and have lots to learn",5
att.com,iphone,"I am absolutely thrilled with this phone! I was a little hesitant at first - converting from an iPhone 7, but the lack of a home button has been no problem at all! It is super easy to use, the camera is phenomenal, and there are lots of neat little features I continue to discover! I would recommend this phone to anyone considering an upgrade! The larger screen is amazing!",5
att.com,iphone,"Full disclosure: I am coming from a Galaxy S8. Now that info is out of the way I truly believe the IPhone X is leap years behind android. I have owned my IPhone 6s for a few years now and love it! The difference is the price point. I’m ok with a few quirks and a few missing features at half the price. I expect perfection at the price point this phone comes in at. And to be perfectly clear, the build quality and camera are amazing! Sadly, that’s about where the greatness wears off with this device. There are so many dozens of useful features missing from this device that any android device would have its laughable. That would be entirely due to Apple wanting to play it safe and make your device dummy proof. There isn’t even an actual file system that’s accessible to the user!! All in all, I can say with confidence stay far away f I’m this device. Save your money and get a flagship android device. You’ll be glad you did.",2
att.com,iphone,"I went from an Iphone6S Plus to the X, and while the phone has some cool new features my biggest complaint is missing the home key- I am constantly turning on Siri and taking screen shot because I hold the phone by the sides and the buttons on the side perform same actions as the home button once did. I’ve onky had the phone 2 weeks .. possible I’ll get use to it ?",3
att.com,iphone,"The iPhone X is great. I loved my iPhone 7 and it served me well, but after upgrading, I wouldn't go back without a fight. I think everyone who hasn't worked with one fears the facial recognition thing. Well, it just works. And going home buttonless??? A breeze. After a few days you will stop poking for one and just swipe automatically. I enjoy he extra screen area.",5
att.com,iphone,"I have had a iPhone for the longest I know, this thing just sucks, I have a green line on the side of the screen also the vibration stop working, now it makes a weird noise, it’s more like a short circuit, I have the phone for a week and now this.",1
att.com,iphone,"THIS IS THE WORST PHONE IVE EVER OWNED! it’s slow, never loads anything, freezes up, doesn’t register when I press buttons I hate it beyond words.",1
att.com,iphone,"The FaceID works great and gets better as more apps support it. The size is an improvement over the 6 Plus, with bigger screen on smaller phone. The processor is so fast I had to adjust my gameplay on Angry Birds. Can't rate the camera (so I hope it doesn't give it 0 stars) because I have not taken a picture but did play with the optical zoom and it is very good.",5
att.com,iphone,"I don't really like the IPhone X. If I wanted an Android, I would have bought one. I wish I would have kept my 7+. It is not user friend, I hate freaking swiping. Bring back the fingerprint recognition. Most offices do not allow cameras.",2
att.com,iphone,"I’m so disappointed, I get this phone with more capacity and it’s freezing most of the time. And when I’m in WhatsApp application all the time is trying make connections, the same with safari. Should I go to att store to returned and change it for something good at least? Thanks",1
att.com,iphone,"This is by far the best IPhone so far. I love everything about it, it is so smooth and so awesome to use! I am so happy that I have this phone and I recommend anyone that is deciding between the IPhone 8 and the IPhone X to get this phone! Actually, I recommend android users to switch to this phone, it is much better!! Oh and the speed is AMAZING, so fast!",2
att.com,iphone,"The iPhone X is overall beautifully designed, excellent camera, Face ID is kool, intuitivemy brilliant without the home button!",5
att.com,iphone,Apple continues to make this product even easier to use. The facial recognition software recognizes me with and without my eyeglasses. No buttons on the front make for easier navigation with gestures only. This version is the best yet. ATT made it easy to exchange my iPhone 7 using the same box that the iPhone X arrived in and a prepaid parcel post label.,5
att.com,iphone,"The iPhone 10 is great, I like the camera editing effects, I like the size because it can still fit in my pocket. The one detail that they did change that is inconvenient is the ear phones. It went from the AC adapter to the normal iPhone charger connection so you can't charge and listen to music at the same time. Otherwise, I'm enjoying the upgrade.",5
att.com,iphone,"When I first set eye on the iPhone X I knew it would be my next purchase that would be amazing! Hands down love everything about the device and most importantly the battery life. I’m always on my device rather it’s to check blogs, stocks or even creating documents on the go and knowing that I can in entire day with a good 45% left is really incredible!",5
att.com,iphone,"I think this is a really good phone. It took some adjustment to my habits, but I am glad I made the switch from the iPhone 7. Face ID works every time and is MUCH faster than Touch ID. New features like the camera and the hard-press keyboard functions are great. Screen is much bigger, so one-handed operation is harder but I never did that much anyway.",5
att.com,iphone,The iPhone X is a at least 2 steps up from the iPhone 7 I exchanged for it. Facial recognition simplifies opening the phone and the gesture driven functions of the phone are extremely easy to master. The edge to edge display enhances all interactions with the phone's apps and utilities. The enhanced camera is an added bonus. Couldn't be happier.,5
att.com,iphone,"Horrible phone! Taking a picture is a nightmare, holding two buttons to snap a picture... who designed this?",2
att.com,iphone,This is the best by far Apple has done in a while. Other then the durability issue. This is a flat out win,5
att.com,iphone,"Overall I like it. I think what I like the least is the face recognition for unlock. I miss being able to reach across the table and unlock with my finger, now I have to pick it up or bend over it. Just a lot less convenient at times. Some of the swiping features are awkward or at least I’m not use to it yet. Besides that everything else is great.",4
att.com,iphone,"The features are of course a plus but the size and weight killed it for me. Im used to the Plus versions of Iphone and this was like downsizing to a 6, even tho everyone keeps saying the screen is bigger but not the phone returned and just got the 8plus with my upgrade until they release a plus size version of this phone i will stick with my 8plus",3
att.com,iphone,Don’t have time for a lengthy review has a numerous amount of bugs in all the pre installed applications,1
att.com,iphone,I really do enjoy the phone overall. It’s very cool. The only thing when setting up your Face ID is make sure to yawn in case you’re like me and get tired and yawn while using your phone so it’ll unlock then as well!! Mine wouldn’t unlock the first time I set it up cuz I didn’t open my mouth during the setup but the second time it worked great!!,5
att.com,iphone,"Thus far I really enjoy this phone. Having come from an iPhone 5, it is a dramtically noticeable improvement when it comes to usability and speed. My one complaint so far is that I wish tutorials were a little more comprehensive on the phone's technology and capabilities. Felt pretty glossed over in that area. Otherwise a very welcome upgrade.",5
att.com,iphone,"Just like anything, it takes a little getting use to when you’ve had the previous for so long! But now I’m so happy I went X than 8Plus. My ultimate decision was a video review from cNet. Beyond the technology, my big sale point was the screen size! Basically same screen size on a smaller body! So much easier to handle and in your pocket!",5
att.com,iphone,"I started using my iPhone X on November 11 2017 and this is the best cell phone I have ever had. I have had cell phones for over 30 years and from where I started to iPhone X is unbelievable. Out of the box, set it up in about 30 minutes, and the battery life is unbelievable. You will not be disappointed it is everything I expected and more.",5
att.com,iphone,"The facial recognition works great. The sound is much better with this phone too! Of course the big screen display is very nice. Camera is awesome! And the phone is really fast, so when you push a hot link just touch it quickly or it won’t activate...it’s that fast! I feel like this phone is somehow is on a higher level than other iPhones.",5
att.com,iphone,My last iPhone was a six. The X isn’t user friendly. I keep saying maybe I will get use to it. Jus to close out apps is difficult. The face recognition on the apps like my banking apps don’t always work. And the phone overall is slow to respond. I’ve always had and iPhone along with all other apple products but this is isn’t as easy to use.,3
att.com,iphone,"I’ve had the iPhone X for a little over a week. This phone is a workhorse and not much it can’t do! I have to admit I’m impressed.. I thought I would miss the size of my 8 plus but I haven’t because of how fast, smooth and solid the X is. No home button wasn’t a problem either as I quickly adapted to the new interface. Ok Apple - I LOVE it!",5
att.com,iphone,"I went from the 7 Plus to the X and it took a little while to get adjusted to the smaller overall size especially the keyboard. However, the device itself is smooth, the response is excellent and it appears to process data, etc pretty quickly. This phone would be perfect if they made it in the Plus size but overall, I like it alot so far.",5
att.com,iphone,"Beautiful phone. Nice feel to it, good size and overall happy with my purchase.",5
att.com,iphone,"Certainly not the quality one would expect, especially at this price point!",1
att.com,iphone,"Coming from a plus, I feel like I've been sent back to the original.",1
att.com,iphone,"I’m a long time Apple user and upgraded from a 6s to the iPhone X. Only thing I have a bone to pick about is that it won’t connect to my current Bluetooth headphones or my car Bluetooth. I know, first world problems. But why do I have to buy all new accessories or car to get things to work. Maybe a trip to the Apple store would help.",4
att.com,iphone,"I upgraded from the 6s to the X due to the updates ruining my 6s. Although it was unplanned, this was probably the best move.
The X delivers. It’s screen is actually BIGGER than the plus models. Only reason people will refute that is because the plus models include large borders around the phone.
Not once has facial recognition failed for me.
The smoothness of switching between apps is great.
It’s very fast. The camera is by far the best I’ve used on a phone. I’m big on photo editing and touching up photos for marketing purposes, and I feel no need to with this.
As for the price, get with the times people. Prices of phones have increased since the original iPhone era. For what phones can do these days, it’s justifiable. I have owned a MacBook since 2008 until it recently bit the dust and this has taken the place of it. Out of the office since I work in Sales, this does everything I need to do.
I give this a 5/5 on all aspects.",5
att.com,iphone,"Before I bought the IPhone X I read almost every review I could. I saw people complaining about the phone size, the screen size, the durability, and the fact that some apps don’t take up the whole screen. WELL I went from the iPhone 7 Plus and I love the phone being small with the screen being bigger I can still see the same as I did on the 7 pulse but I also don’t have to worry about it not fitting in my hand very well. I’ve already dropped this thing twice and there’s nothing wrong with it at all (I don’t have the glass screen protector and a speck case though. Also most of the apps do fit to my screen perfectly the only one I have seen not is my schools app which makes sense cause they probably aren’t to worried about updating it just for the new phone. I love this phone though very easy to use, really cool features, and the camera is TO DIE FOR. I really like not having a home button, it actually makes it easier and the facial ID works really fast.",5
att.com,iphone,I absolutely love this phone. I couldn’t be any happier with it. I had it originally with a different carrier but ended up having to downgrade to the iPhone 6 and missed my X. Finally got a new one when I switched to AT&T and I can’t tell you how much of a difference it makes. The photos alone are a reason to upgrade to this phone.,5
att.com,iphone,I bought the Apple watch series 3 and the iPhone X on the same day. Both products live up to every inch of their advertisements. I have never owned a phone with so many features and capabilities with such ease of operation. So do yourself a favor and make your life easier..........go get the iphone X. You won't be disappointed!,5
att.com,iphone,"I love this phone, the no home button and face recognition is what makes me so happy with this choice. Even though the sales were low and they are going to discontinue the model did disappoint me, as now my week old iphonex is obsolete... Go Apple, they should give us a trade in value for the new phones coming out this summer. JS",5
att.com,iphone,"Overall pretty good. Nothing extravagant. If you are accustomed to an iPhone plus, I certainly would not recommend. The full screen feature is overrated and pretty much for the home screen and some videos on you tube. If the X came as a plus, I'd certainly get it. I think the advertisement for the full screen effect is misleading.",3
att.com,iphone,The phone is not very user friendly. You have to get online to find out how you can hang up a phone call. The phone is very slow. There are so many issues not enough room to list them.,1
att.com,iphone,This phone is everything I expected it to be. Love it!,5
