source,phone,review,rating
att.com,iphone,"So to start with, don’t get me wrong, it’s a beautiful phone. However, for the price point, it was way overpriced. If you have an iPhone 7 or 7+ then truly the upgrade is not worth it
I had an issue with my 7+, but I wasn’t real happy with, so this was a forced upgrade.
So quite frankly, I don’t think it’s worth enough bread for my iPhone 7 or iPhone 7 Plus. I would probably wait a year.",3
att.com,iphone,"Still playing w/it. However, I can say that I miss the home button. Don’t really care for the side button function. But will see, I’ll give it a little more time.",5
att.com,iphone,"The iPhone X is great so far, only one crazy glitch, the volume turns up on it's own after about 5 minutes of listening to music. Does it every time, volume just doubles all by itself...???",4
att.com,iphone,"Phone is good, but am having software issues where the lock screen goes blank without showing time or pass code. I have to restart everytime this happens. There is no way to resolve it yet",2
att.com,iphone,"what an amazing iphone this is, i believe its the android killer iphone X is the best thing since sliced bread its the best ever period lightning fast the pictures the video is stunning love the new ring tone... iphone X is so much better and smaller with bigger screen thank you and love you Apple",5
att.com,iphone,The Bluetooth is problematic. One should not have to search for solutions to a problem on YouTube when you have a new phone. iPhone consistently declines in quality and reliability,2
att.com,iphone,Phone reception is horrible with one bar. You can hear the person but they cannot hear you.. works fine with 2 bars. I did not have this problem with the iPhone 5,3
att.com,iphone,"The phone is average. Photo clarity is wonderful, however my phone keeps freezing at the home screen which throws me for a loop. Overall it’s average to other iPhones.",1
att.com,iphone,"Small usable screen compared to the iPhone 7 Plus. Poorly thought out design (notch, control center, etc.)",2
att.com,iphone,I thought the X was going so be a significant upgrade from my 7Plus. I was told over by the customer service/sales dept that the the X was the same size as the 7plus and that it had much better features. They also told me that all iPhones are moving towards getting rid of the home button and that getting the x would get me used to navigating without it. I can’t stand this phone... it’s significantlh smaller and as far as the upgrades from the 7s... I really can’t tell any difference and the no home button is annoying! I’m hoping I can still exchange,2
att.com,iphone,"I used to be a huge iPhone fan back in the early iPhone days. My last iPhone I liked was the 4S and I felt they got worse from there. I spent the last few years using a galaxy phone and loving them. The iPhone X is the first iPhone to bring me back to apple and actually Be satisfied in years! It’s very fast, the screen is finally on par and it holds a great charge.",5
att.com,iphone,Pre -ordered on launch day -rc'd earlier than original prediction. Was very excited to begin using. Reality check! Screen was scratched right out of the box! How durable is this phone going to be?! Have had many previous iPhones that didn't scratch after having for years. Needless to say had to return. I am seriously considering not getting another & sticking with my 7 plus.,1
att.com,iphone,"I switched carriers so I decided to upgrade and went with the X. I was a little worried that I would miss my finger print, but so far I am very happy with the Face ID. I love the animal emjos. The camera is by far the best camera you could ever want on a phone. Learning the new gestures did take a few days to get use to and even after three weeks I’m still getting use gesturing. I love the size it’s not too small and not to big like the plus. Overall it is a very nice phone and worth the money. I came from iPhone 7 and 8 plus and I’m very happy I took a chance on the X.",5
att.com,iphone,"Pros: Phone design is good
Cons: Face ID doesn't work all the time. But, when it works it is extremely fast Videos doesn't come in full screen Hard to resist to not press home button if you have been an iPhone user all along Lot of bugs in this release",3
att.com,iphone,I love the iPhone X other than it’s size. I am a diabetic and can not see very well. The IPhone 7 Plus with large bold text was perfect for me. I can barely see to use my X even with glasses. Unfortunately this is a disappointment to me because there isn’t a PLUS option for those with difficulty seeing well like myself.,3
att.com,iphone,"The phone itself works great! It is just what any iPhone user would expect. HOWEVER, it is so fragile! I always use a screen protector and I throroughly research good cases for my phones. Still, the glass on the back of the phone broke almost immediately, and the cost to repair it without Apple care is ridiculous. I don’t know who had the idea to put the glass on the back of an iPhone, but firstly, it was a bad idea, and secondly, they should have warned us about the fragility.",2
att.com,iphone,"People can talk about how Samsung has been the pioneer of new advancements in next gen phones; that might be true, but you can’t compare to Apples reliability and durability of their phones. I’m contastantly asked to use my phone because an app/battery doesn’t not work on a Samsung phone.
The iPhone X is a beautifully design phone. The battery/processor/camera stand out. I was skeptic about the Face ID, but I love the fact I can just log in to anything with just my face.",5
att.com,iphone,"Bottom line first- I like the iPhone X, I don't love it. My primary negative comment is the screen is not as large as my 6s Plus, no way! The X screen is SLIGHTLY longer but THINNER. The screen configuration results in the keyboard and characters being much smaller requiring anyone with normal sized fingers to turn the phone sideways to type. Most of the screen is not used by webpages and most apps and as a result you still have the border top and bottom. Apple says vendors will adapt, who knows? Face recognition, Apple Pay etc. work great and the processor is the fastest yet. Battery life is not spectacular either. The new gestures take a while to perfect but it is not a big deal to learn. I still prefer the home button to the constant need to swipe up on the new X. Phone is pricey so think twice as bang for the buck may be slightly lacking. All in all, my 6s plus is just as good, just not as fast.",4
att.com,iphone,"I had high hopes for the long awaited iPhone X. I must say that I am disappointed with lack of new features. The only new feature is the Face ID and perhaps standard camera upgrade. Otherwise there’s nothing much different than the 6, 7 or 8.",2
att.com,iphone,"The iphone x is unique in its own way. It is a step away from the ""classic"" layout, look and feel for iphones. I've heard a mix of good and bad things about this phone specifically. The features on this phone are all what they are made out to be. The face ID is absolutely mind blowing and it one of the easiest things to use. This phone is compatible for wireless charging which is so nice for us lazy people. It is bigger than the iphone 8, yet smaller than the plus. It has portrait mode on both front and back cameras, which makes the picture quality amazing. I really thought that not having a home button would bother me, but since i've had this phone for a while now i don't think i could ever go back to a home button.",5
att.com,iphone,"The X truly has the “x” factor. It is seemlessly comfortable to use. Smooth and fluid to the touch and each gesture reflects similar haptic responses. I would say this is the best iPhone I have ever owned. Having last the 7 plus I was worried that the size would be a negative impact, it is not. the screen is larger and yet so much easier to hold and interact with. The length of the screen is great when reading articles and beyond texting I seldom have to use two hands. The experience transports you back to age ten atop your bike ripping down the tallest hill in the neighborhood, well you get The drift. It’s easy, fun, and reminds you that things will always get better, but most importantly enjoy the experience “now!”",5
att.com,iphone,"I got the IPhone X when I switched to at&t. The battery life only lasts around 7-9 hours if you constantly use it. The price isn’t worth it either considering the XR is better and cheaper. Otherwise, the camera and Face ID are great and overall it’s a good phone. Would recommend to get an XR.",3
att.com,iphone,"This is a beautiful phone. It’s not really an issue that there is no home button or headphone jack, as swiping up from the bottom works perfectly to take you home, and Apple includes earbuds that plug into the lightning charger port in case you don’t have wireless headphones. The glass back, front screen with curved sides, and bigger picture all make this a beautiful object, though because it is so incredibly expensive, you will probably want to put it in a case and put on a screen protector, which will compromise its beauty. The camera also takes gorgeous photos.",5
att.com,iphone,"The iPhone X is amazing in every aspect! If you're worried about the notch at the top, it disappears after getting used to. A lot of people will complain about the price but get over it, if you can afford it, get it. End of story! I do recommend a case for it as it is all glass.",5
att.com,iphone,AT&T do a great job when I land in the Store Is full of opportunities for get your Apple gadgets.,5
att.com,iphone,"Not having a home button takes a little getting used to, but after just a few hours, it felt comfortable. We bought an Iphone 8 at the same time and getting it set up using the home button felt awkward and clunky compared to the X. Also, facial recognition is much more of a big deal than I thought it would be. Just having to look at the camera rather than use a fingerprint is much more convenient. Concerns that I had read about problems with the recognition working at angles or in total darkness turned out to be non-issues. Battery life could be better - a lot better, really - but I'm able to get a full day of heavy use out of it, so it hasn't been that big of an issues for me. Overall, I'm very happy with the phone.",5
att.com,iphone,"After using it for a week, I’ve discovered that I miss several aspects of the IPhone 7 Plus. Miss the battery percentage being available on the top right corner without having to swipe. Miss the home button and it’s double click features. Miss the full screen without the camera affecting the view amongst other small but significant things.",3
att.com,iphone,"The phone gets some getting use to but all in all it’s spectacular. My only complain would be how slippery it is, it literally slides of everything even on my wireless charger it’s seems to just slide off on its own. If it wasn’t for that I would give it 5 stars",4
att.com,iphone,"On you tube you can’t get full screen , and many other applications , this phone is good to upgrade from the 7 not from the 7 plus they should have made x plus",1
att.com,iphone,Love the phone love taking photos all the phone if perfect,5
att.com,iphone,iPhone X is the best phone I’ve ever had! Thanks AT&T.,5
att.com,iphone,"The phone works good, my only issue with this phone is the size of the screen. The screen on the X is about the same size as standard iphone 7! Why am I paying more money for a phone that has smaller usable screen area than my old iphone 7 plus? I will be returning this phone and getting an iphone 8 plus! This is the most disappointing iphone yet! I will keep my 8 plus, until they make a X-Plus!",3
att.com,iphone,I love the speed and qualityof my iphone x,5
att.com,iphone,"Face ID is nice , go get you one ASAP",5
att.com,iphone,Galaxy killers lol Best phones,5
att.com,iphone,Amazing camera features!!,5
att.com,iphone,"What can I say? State-of-the-art device that leaves the competition in the dust! It’s everything you expect in an iPhone and more. Facial ID is the bomb while screen size is (in my opinion) optimal though smaller than the iPhone 8. I say optimal because at some point in the evolution of smart phones as the screens get progressively larger the device ceases to be a phone and becomes a tablet or mini-laptop. If you want a phone buy an iPhone X. If you want a tablet (or larger) then buy that type device and “enjoy” lugging that around. As for me, the iPhone X is easy to see with unmatched clarity, and is easy to carry on your belt or in your pocket (or anywhere else you desire) without toting some sort of “brick” around with you.",5
att.com,iphone,I upgraded from the 6+. I was always running out of storage so I was super excited to see that this phone came with more storage and I don’t have to purchase additional storage from Apple. The phone size is great. It’s not as big as the 6+ and fits in my back pocket nicely. The new emoji option is fun. The camera takes amazing photos and I love the selfie option it gives you multiple lighting options and there is an option to make comments on your pictures before you send them. The battery is also great it lasts all day even with excessive phone use.,5
att.com,iphone,Only purchased this phone a week ago and already having problems. My screen went flashing green and is frozen. I can not use it and AT&T will not help me they said it's an Apple problem. Very disappointed!!,1
att.com,iphone,"I have to admit that I went in with a negative attitude for the iphone. I went and got the first iPhone when it came out and I hated it. I was back at ATT within a week to get another android. Fast forward, I was intrigued by the IPhone 6 plus, so I tried it and again I needed my android so it went back. Now the IPhone X comes on scene, I decided to give it a shot. Mainly because my beloved androids lacked internal memory and 256gb sounded awesome. Yes, I am aware you can install an SD Card but they have locked the card so that it cannot be used for apps. My internal memory on my S7 was full and I had over 100gb on my SD Card that I could only use for pics, vids, and music. Way to go Android, expandable memory my butt. Anyway, back to the IPhone X. I was really concerned about losing my customization options like my widgets and my apps. I have had this phone for a few days now and I can honestly say that I am so happy I gave it a shot. I had my ringtones on it in a few minutes, and I have made more. Yes, you do have to use ITunes to do that but it really does only take a few minutes. I only found one of my apps that was not available on iPhone but I got another that does everything that app did. The Camera's on this phone are amazing and I really love the face ID. I transferred all my music over and after I transferred everything from my S7 over I still have over 200gb of internal memory left. I really do love this IPhone, that is something I was not planning on doing. The phone is gorgeous and I hate covering it with a case but I plan on having this phone for a long time. Good job Apple, and Android...get your game on or a lot of other android users will be saying goodbye.",5
att.com,iphone,"I went from an iPhone 7 Plus to the X. I was skeptical because it was smaller, the face recognition was different for me, and no home button. However my mind was changed within the first week of using the X. It’s more streamlined, faster, clearer screen, the audio is killer, and the face recognition is saving time. I went back and forth the first week with whether or not I should change to the 8 Plus and now I’m so glad I didn’t!",5
att.com,iphone,"I was a little hesitant on the idea of no home button, however it is easily something that I got used to not having. Pretty much, I feel like the phone is still very similar to the 7-8 models which are great overall in my opinion anyways. I did go from the 7plus to the xphone and it is very small compared to plus for sure and that takes some adjusting to in handling the phone, etc. It's camera quality is also similar to the 7plus but there are added filters and such with the new xphone. I do not feel like I will be disappointed in my upgrade at all !",5
att.com,iphone,This is the best iPhone yet people complained when the plus sized phones came out and now they complain when it's more hand friendly I think people just like to complain the X has way better features then any Samsung and 8plus the 8 only has a LCD display the X has oled which is WAYYYY BETTER deeper blacks brighter whites and colors plus it has a bigger screen then the 8plus which is amazing,5
att.com,iphone,"I phone x has nice camera in front and back, but the face identification dosenot work perfectly. LG V30 works better. Identifying your voice as command is worst. Unlocking is hard. It is heavy in hand. I did not like. I returned that. I got LG v30. It is very more responsible than iphone X.",1
att.com,iphone,"Overall I enjoy my new phone, I switched from an IPhone 6 so I have a lot of catching up to do. I don't really like that I cannot listen to my headphones and traditionally charge my phone at the same time. I also am not a fan of having to keep up with the head phone adapter so I can use my head phones on my MacBook. I like being able to easily swipe between applications and the larger screen is definitely a perk.",5
att.com,iphone,The phone is smaller than my 7 plus but the screen is larger. So far I love it. YouTube videos can been seen full size you just need to swipe the screen from inside out to widen it to full screen. The X is fast and the facial scan works great so far.,5
att.com,iphone,It’s really not worth the money. I myself miss my iPhone 7. The battery really sucks on the iPhone .,1
att.com,iphone,This phone felt weird at first but it felt better after every hour of owning it. It’s amazing!!!,5
att.com,iphone,"I was initially disappointed because although he screen size is 5.8, it’s narrower than the Plus’ 5.5 screen. I did adjust to the minor loss of width, and actually appreciate how much better the X fits in my hand, and my pockets! The Plus was a monster that didn’t fit anywhere. I bought the X despite it having Face ID and no Touch ID, but I quickly fell in love with Face ID! I especially love that Face ID does not show notification previews until I unlock it with my face; I no longer need to place my phone screen down to prevent other people from seeing my texts.
The screen is stunningly beautiful, especially when watching movies or videos. I hated the notch before I bought the phone and thought I’d end up returning it because it would annoy me that much but my fears were unfounded. I don’t really notice the notch much anymore, primarily because it’s above the reading area.
I could go on and on about this phone but I’ll stop now :) Great job Apple!
P.S. Battery life could be better. I do miss the battery life of the Plus but I wouldn’t go back to it.",5
att.com,iphone,No big deal. Same as others and not worth the big $$$$$,3
att.com,iphone,"The one issue i have... I keep taking screen shots! In order to wake the phone up, you have to press the side button- which is you hit the volume and that together- takes a screen shot! and that, is annoying as all heck. Otherwise, the phone is beautiful. easy, seamless, and the display is truly WOW. also, it continually amuses me that i don't have to freak out if i get it slightly wet. like, my hands are wet form dishes, etc. its really nice to know that you don't have to worry!",4
att.com,iphone,"I’m in love with the iPhone X! The new design is so amazing. I love the phone size, as the plus was getting a little large for my liking. This one is much more manageable for one handed use.",5
att.com,iphone,"It’s hard to use. Specifically, I find difficult: Taking screen shots, turning it off, I don’t like swiping up instead of having a home button, the size -it’s too big to hold in one hand.",1
att.com,iphone,"At first sight, the well known notch design appears to be highly unattractive. However, once the device is in hand, you begin to notice it less often. The fact that one can hold their smartphone in one hand again without sacrificing screen real estate is fantastic! The new iphone X feels and is premium all around! The new OLED display provides a rich and vibrant viewing experience without emitting overly saturated colors, camera technology is out of this world, speed is completely insane, and the battery life is much better than expected! Sure, the iphone X isn't perfect in every way possible but is indeed a step in a new direction; revolutionary. This is by far the best iphone to date and I'm sure it's only going to keep getting better! -Harmonious",5
att.com,iphone,Had my phone less than a week. Frozen home screen while out of town. Tried to reset it and it called 911 and could not hang up. Very upset and frustrated along with a big Disappointment.,2
att.com,iphone,"Just one word, Amazing , great design ,great Screen, loved the new improved OLED screen, Camera captures the intricate details , high resolution pictures and videos . Face ID works smoothly , easier than Touch ID to setup. Animoji is fun. Moving towards the future, this iPhone upgrade is definitely worth it . Apple has always been an innovator. Great Product. Hands Down iOS.",5
att.com,iphone,"I recently pre-ordered the iPhone X 256 GB on October 27th. It shipped on November 7th. I was so excited about the phone that I picked it up from the post office. I took the box to AT&T store and it was activated right out the box.
Let’s get to the point, the phone is very nice, sleek, and sexy. It the Face I.D works just as good as Touch ID if not better. The technology they put into making this device is extremely powerful and accurate. This is the iPhone I’ve been waiting for since 2007.
The camera on this phone is superb and does so many different things. Facial recognition is even tied into your emojis which is nice.
The battery life on this phone actually is very good. It last me the entire day and some with moderate to heavy usage.",5
att.com,iphone,"I have to admit, I was very scared ordering this phone. I went as far as making my husband promise he would give me his 7 plus if I didn’t like the X. I have to say I love this phone. I upgraded from the 6s plus. It is smaller which I actually like because I find it easier to handle. The facial recognition was the scariest part for me. I was afraid I would miss the thumbprint for accessing the phone and most of my apps. Truthfully, I don’t. The facial recognition is much better by far. The apps that I would access using my thumbprint, I now access using the facial recognition. There are many pluses over my previous phone. Much smooth movement throughout the phone. The screen is much sharper. Definitely a great phone that I am recommending to everyone.",5
att.com,iphone,"It was worth waiting in line for two hours to get this phone. I love all the features, it runs smoothly and fast. Although I do wish the screen was a little bit bigger. I’m really into big screens and this screen seems to be not much of a big difference from the iPhone 7+ and iPhone 8+ phones, but other than that the iPhone X has lived up to the hype. I love it!",4
att.com,iphone,I just began getting my credit back together when I came by the store and next thing I know I’ve gotten the Newest IPhone and I’m so thankful to not just have the X but I’m with a reliable company who works with their customers!!! Hence why not only do my children have Apple as well but I’m also the proud owner of the Apple Watch and AirPods.. hopefully soon a Ipad,5
att.com,iphone,This is the best iPhone yet .. I switch from android to get this phone.. I really hope the rumors of apple killing this phone aren’t true.. the build quality and the weight of the phone is perfect .. the edge to edge screen is super beautiful.. att ship my order really fast and had it the next aftertnoon thank you att and Apple I can’t say enough about this phone,5
